{
    "AppInstanceName": "Ville de Desgoffe",
    "AppSubtitle": "Guichet Citoyen",
    "DefaultLocale": "fr",
    "GerdaAI": {
        "IsEnabled": true,
        "SystemPrompt": "Tu es un agent administratif de la Ville de Desgoffe. Sois formel, poli, et cite les articles du Code Municipal quand c'est pertinent. Utilise un ton bureaucratique mais bienveillant.",
        "SpamDetection": {
            "IsEnabled": true
        },
        "ComplexityEstimation": {
            "IsEnabled": true
        },
        "Ranking": {
            "IsEnabled": true
        },
        "Dispatching": {
            "IsEnabled": true
        },
        "Anticipation": {
            "IsEnabled": false
        }
    },
    "PerformanceProfile": {
        "TargetResponseMsP95": 300,
        "TargetResolutionHoursP80": 120,
        "SlaDescription": "Les demandes citoyennes sont priorisées selon le type, le quartier et la priorité déclarée."
    },
    "DemoProfiles": {
        "Standard": {
            "Description": "Traitement équilibré de toutes les demandes avec priorisation par urgence administrative.",
            "RankingStrategy": "SeverityAndPriority",
            "DispatchingStrategy": "ServiceBased"
        },
        "NuisanceFocus": {
            "Description": "Profil axé sur les nuisances sonores et de voisinage avec résolution accélérée.",
            "RankingStrategy": "NoiseComplaintsFirst",
            "DispatchingStrategy": "NeighborhoodInspector"
        }
    }
}