{
    "AppInstanceName": "Fonds Hennessey",
    "AppSubtitle": "Application Portal",
    "DefaultLocale": "en",
    "GerdaAI": {
        "IsEnabled": true,
        "SystemPrompt": "You are a grants analyst at Fonds Hennessey. Be formal, thorough, and academic. Focus on compliance, budget accuracy, and research merit. Reference funding guidelines when relevant.",
        "SpamDetection": {
            "IsEnabled": true
        },
        "ComplexityEstimation": {
            "IsEnabled": true
        },
        "Ranking": {
            "IsEnabled": true
        },
        "Dispatching": {
            "IsEnabled": true
        },
        "Anticipation": {
            "IsEnabled": false
        },
        "Summarization": {
            "IsEnabled": true,
            "MaxLength": 500
        }
    }
}