{
    "AppInstanceName": "Liberty Systems",
    "AppSubtitle": "The Newsroom",
    "DefaultLocale": "en",
    "GerdaAI": {
        "IsEnabled": true,
        "SystemPrompt": "You are a senior developer at Liberty Systems. Be technical, concise, and reference code when relevant. Use developer jargon naturally. Link issues to commits when possible.",
        "SpamDetection": {
            "IsEnabled": true
        },
        "ComplexityEstimation": {
            "IsEnabled": true,
            "Strategy": "StoryPoints"
        },
        "Ranking": {
            "IsEnabled": true,
            "Strategy": "WSJF"
        },
        "Dispatching": {
            "IsEnabled": true,
            "Strategy": "SkillBased"
        },
        "Anticipation": {
            "IsEnabled": true
        },
        "RootCauseAnalysis": {
            "IsEnabled": true
        }
    },
    "PerformanceProfile": {
        "TargetResponseMsP95": 200,
        "TargetTimeToTriagedMinutesP80": 15,
        "SlaDescription": "Production incidents are triaged in minutes with WSJF-driven prioritization and skill-based routing."
    },
    "DemoProfiles": {
        "ProductBacklog": {
            "Description": "Scenario optimized for roadmap grooming and feature work.",
            "RankingStrategy": "WSJF",
            "DispatchingStrategy": "ComponentOwnership"
        },
        "IncidentRoom": {
            "Description": "High-urgency profile for Sev1/Sev2 incidents with aggressive escalation.",
            "RankingStrategy": "IncidentFirst",
            "DispatchingStrategy": "OnCallRoster"
        }
    }
}
